{"$schema":"https://json-schema.org/draft/2020-12/schema","$id":"https://example.invalid/ena/research/memory-metabolism/iteration-0.5/memory-set.schema.json","title":"ENA Memory Metabolism Research Memory Set iteration 0.5","type":"object","required":["schema_version","records","provenance_sets","projections"],"properties":{"schema_version":{"const":"memory-metabolism-research-0.5"},"provenance_sets":{"type":"array","items":{"$ref":"#/$defs/provenance_set"}},"records":{"type":"array","items":{"$ref":"#/$defs/memory_record"}},"projections":{"type":"array","items":{"$ref":"#/$defs/decision_projection"}}},"additionalProperties":false,"$defs":{"validity":{"type":"object","required":["mode","revalidate_before_material_use"],"properties":{"mode":{"enum":["IMMUTABLE_OCCURRENCE","CURRENT_STATE","CONDITIONAL","HISTORICAL","UNKNOWN"]},"revalidate_before_material_use":{"type":"boolean"},"conditions":{"type":"array","items":{"type":"string"}}},"additionalProperties":false},"boundary_transition_claim":{"type":"object","required":["mode","resolution_ref"],"properties":{"mode":{"enum":["HOST_RESOLVED_CHANGE","HOST_RESOLVED_COMPOSITION"]},"resolution_ref":{"type":"string","minLength":1},"notes":{"type":"string"}},"additionalProperties":false},"provenance_set":{"type":"object","required":["provenance_id","source_roots","evidence_refs","content_access_ref"],"properties":{"provenance_id":{"type":"string","minLength":1},"source_roots":{"type":"array","items":{"type":"string","minLength":1},"uniqueItems":true},"evidence_refs":{"type":"array","items":{"type":"string","minLength":1},"uniqueItems":true},"content_access_ref":{"type":"string","minLength":1,"description":"Opaque Host-resolved access boundary for dereferencing provenance content; separate from compiled-content access."},"notes":{"type":"string"}},"additionalProperties":false},"memory_record":{"type":"object","required":["record_id","layer","claim_type","content","source_roots","content_access_ref","validity"],"properties":{"record_id":{"type":"string","minLength":1},"layer":{"enum":["OPERATIONAL","EVIDENCE","KNOWLEDGE","COMPILED","IDENTITY","ARCHIVE"]},"claim_type":{"enum":["OCCURRENCE","OBSERVATION","BELIEF","HEURISTIC","POLICY","PREFERENCE","TASK_STATE","DECISION_RECORD","AUTHORIZATION_OBSERVATION","INDEX"]},"content":{"type":"string","minLength":1},"derived_from":{"type":"array","items":{"type":"string","minLength":1},"uniqueItems":true},"evidence_refs":{"type":"array","items":{"type":"string","minLength":1},"uniqueItems":true},"source_roots":{"type":"array","items":{"type":"string","minLength":1},"uniqueItems":true},"provenance_ref":{"type":"string","minLength":1},"support_mode":{"enum":["NONE","SINGLE_SOURCE","MULTI_SOURCE_DEPENDENT","INDEPENDENT_CORROBORATION"]},"decision_material":{"type":"boolean"},"content_access_ref":{"type":"string","minLength":1,"description":"Opaque Host access-boundary reference. It is not a universal RBAC/ABAC/IFC label."},"boundary_transition_claim":{"$ref":"#/$defs/boundary_transition_claim"},"evidence_status":{"enum":["PRESENT","LAWFULLY_REDACTED","TOMBSTONE","NOT_APPLICABLE"]},"evidence_availability":{"enum":["FULL","DEGRADED","UNAVAILABLE","UNKNOWN"]},"authority_reference_ids":{"type":"array","items":{"type":"string","minLength":1},"uniqueItems":true},"validity":{"$ref":"#/$defs/validity"},"relations":{"type":"array","items":{"type":"object","required":["type","target"],"properties":{"type":{"enum":["SUPPORTS","CONTRADICTS","SUPERSEDES","DERIVED_FROM","AUTHORIZED_BY","OBSERVED_IN","FALSIFIED_BY"]},"target":{"type":"string","minLength":1}},"additionalProperties":false}},"supersedes":{"type":"array","items":{"type":"string","minLength":1},"uniqueItems":true},"conflict_handling":{"type":"string"},"mutation":{"type":"boolean"},"governance_ref":{"type":"string"},"notes":{"type":"string"}},"additionalProperties":false},"decision_projection":{"type":"object","required":["projection_id","resolved_actor_access_refs","candidate_record_ids","disclosed_record_ids","used_current_record_ids","used_historical_record_ids","revalidated_record_ids","inspected_provenance_ids","host_resolved_boundary_record_ids","consequence","authority_required"],"properties":{"projection_id":{"type":"string","minLength":1},"resolved_actor_access_refs":{"type":"array","items":{"type":"string","minLength":1},"uniqueItems":true,"description":"Trusted Host input: access-boundary refs the actor/context is resolved to access."},"candidate_record_ids":{"type":"array","items":{"type":"string","minLength":1},"uniqueItems":true,"description":"Pre-disclosure candidates; may be selected by an internal retrieval organ before actor-visible access."},"disclosed_record_ids":{"type":"array","items":{"type":"string","minLength":1},"uniqueItems":true,"description":"Records actually exposed to the decision actor/context. Access is checked here."},"used_current_record_ids":{"type":"array","items":{"type":"string","minLength":1},"uniqueItems":true},"used_historical_record_ids":{"type":"array","items":{"type":"string","minLength":1},"uniqueItems":true},"revalidated_record_ids":{"type":"array","items":{"type":"string","minLength":1},"uniqueItems":true},"inspected_provenance_ids":{"type":"array","items":{"type":"string","minLength":1},"uniqueItems":true},"host_resolved_boundary_record_ids":{"type":"array","items":{"type":"string","minLength":1},"uniqueItems":true,"description":"Trusted Host input: records whose represented boundary transition has been resolved for this projection."},"consequence":{"enum":["NON_MATERIAL","MATERIAL"]},"authority_required":{"type":"boolean"},"external_authority_basis":{"type":"string"},"notes":{"type":"string"}},"additionalProperties":false}}}